PageNumber,Year,Title_TR,Title_EN,Abstract_TR,Abstract_EN,Keywords_TR,Keywords_EN
404,2021-2022,Saydam Polimer Yüzeylerinde Yapışmanın Artırılması İçin Aktivasyon Çalışması,Activation Study to Increasing Adhesion on Transparent Polymer Surfaces,"Türk Havacılık ve Uzay Sanayii’nde kanopi takımlarında kullanılan ve projede bahsi geçen saydam polimerler, Polimetilmetakrilat (PMMA) ve Polikarbonat, yüzeylerinde çeşitli kaplamalara ihtiyaç duymaktadır. PMMA üzerinde yoğunlaşan çalışmalar sonucunda akrilik yüzeyler için Indium Tin Oxide (ITO) kaplamanın tek başına yeterli olmadığı anlaşılmıştır. Kaplamaların yüzeye daha iyi tutunabilmesi ve mevcut sorunun çözülebilmesi için yüzeye fiziksel ya da kimyasal işlemler uygulamak gerekmektedir. Bu yöntemler; yüzeyi fonksiyonelleştirmek için yüzeye organik moleküllerin bağlanması, ITO kaplaması öncesi yüzeye altın gibi başka bir metal kaplama yapılması ya da yüzeyi hazırlamaya yarayan plazma metodu ile yüzey temizleme ve/veya yüzeyde aktif gruplar oluşturma olabilir. Bu çalışma, TUSAŞ bünyesinde mevcut soruna çözüm olarak yüzeyin sadece alkol ile temizlenmesi adımının plazma yöntemi ile yüzey temizleme ve/veya yüzeyde aktif grup oluşturma metodu ile geliştirilmesini amaçlamaktadır.","Transparent polymers, Polymethylmethacrylate (PMMA) and Polycarbonate, which are used in canopy sets in the Turkish Aerospace Industry and mentioned in the project, need various coatings on their surfaces. As a result of studies focused on PMMA, it has been understood that Indium Tin Oxide (ITO) coating alone is not sufficient for acrylic surfaces. It is necessary to apply physical or chemical processes to the surface in order for the coatings to adhere to the surface better and to solve the existing problem. These methods are; functionalization of the surface by binding of organic molecules to the surface to; immobilization of metal nanoparticles such as gold on the surface before ITO coating; or surface cleaning and/or formation of active groups on the surface by the plasma method used to prepare the surface. This study aims to develop surface cleaning and/or the active group formation method on the surface with the plasma method as a solution to the current problem in TUSAŞ in which the cleaning the PMMA surfaces are made only with alcohol.","Saydam polimerler, PMMA, yüzey kaplama, plazma metodu","Transparent polymers, PMMA, surface coating, plasma method."
408,2021-2022,"Shimmy Etkisinin Modellenmesi, Kontrolü ve Test Düzeneği Tasarımı","Modeling, Control of Shimmy Effect and Test Rig Design","Shimmy etkisi, hava ve kara araçlarında görülebilen, mekanik sistemlerdeki salınım hareketlerinin davranışlarını tanımlayan bir fiziksel fenomendir. Bu çalışmada Shimmy davranışı uçak burun iniş takımı üzerinde modellenmiştir. Elde edilen modelin test edilebilmesi için endüstriyel standartlara uygun bir test düzeneği geliştirilmiştir. Test düzeneği yardımı ile yapılan deneyler ile parametre eşitlemesi yapılmış ve model doğrulaması yapılarak genişletilmiş model elde edilmiştir. Genişletilmiş model için PD ve PV kontrolör tasarımları yapılarak belirli isterler altında Shimmy hareketi kontrol edilmiştir.","Shimmy effect is a physical phenomenon that describes the behavior of oscillating movements in mechanical systems that can be seen in air and land vehicles. In this study, the Shimmy effect for landing gears is modeled. In order to test the obtained model, a test setup compatible with industrial standards has been developed. Parameter equalization has done with the experiments, and the extended model was obtained by making the model validation. PD and PV controllers designed to control the Shimmy effect under certain requirements.","İniş takımı, Shimmy hareketi, Test düzeneği, modelleme, parametre eşitleme, kontrol.","Landing gear, Shimmy movement, Test rig, modelling, parameter equalization, control."
414,2021-2022,Sikorsky Buyback Projesi için Havacılıkta Kullanılan Bağlayıcılar,Aviation Fasteners for the Sikorsky Buyback Project,Bu çalışmada Lockheed Martin’in bir alt şirketi olan Sikorsky Aircraft ile Türk Havacılık ve Uzay Sanayii arasında yapılan anlaşma neticesinde Türkiye’de üretilen Sikorsky S-70 helikopter parçalarında ve tamamen yerli olarak imal edilen T- 70 Genel Maksat Helikopteri’nde kullanılan havacılık bağlayıcıları incelenmiştir. Bu bağlamda söz konusu şirketler ve projeler incelenmiştir. Ardından söz konusu bağlayıcıların neler olduğu ve genel özellikleri ortaya konmuştur. Bu bağlayıcıların hangi parametrelere göre tasarlandığı araştırılmış ve montaj işlemi tamamlandıktan sonra bağlayıcıların kalite kontrolleri kapsamında incelenen kriterler ve kabul edilen sınırlamalar çalışmaya dahil edilmiştir. Ardından projede kullanılan bağlayıcılar ölçülerinden bağımsız olarak listelenmiştir.,"In this study, aviation fasteners used in Sikorsky S-70 helicopter parts manufactured in Turkey and completely domestically manufactured T-70 Utility Helicopter, as a result of the agreement between Sikorsky Aircraft, a subsidiary of Lockheed Martin, and Turkish Aerospace Industries, were investigated. In this context, these companies and projects were examined. Then, what these fasteners are and their general properties are revealed. It was investigated according to which parameters these fasteners were designed, and after the assembly process was completed, the criteria examined within the scope of the quality controls of the fasteners and the accepted limitations were included in the study. Then, the fasteners used in the project are listed regardless of their size.","Havacılık, bağlayıcı, montaj, tasarım, kalite, helikopter","Aviation, fastener, assembly, design, quality, helicopter"
416,2021-2022,SOQPSK-TG Modülasyonu,SOQPSK-TG Modulation,"Bu çalışma ile uçuş testleri , uçuş testlerinde telemetri sistemleri ve bu konu üzerinden modülasyona dikkat çekilmiştir. Bu alanda gelişen teknoloji ile ihtiyaçlara cevap vermek adına geliştirilmiş SOQPSK-TG hakkında teorik bilgilere yer verilmiştir. Hedef , SOQPSK-TG modülasyonu kullanarak bir telemetri istasyonundan hava aracının uçuş testi ile uygun şekilde üretilmesini ve güvenli operasyonlar için uygun durumda olmasını sağlanmasıdır. Yakın zamanda SOQPSK modülasyonu bant genişliği açısından verimli bir modülasyon tekniği olarak tanıtılmıştır. Bu sinyallerin ana avantajı daha iyi spektral verimliliktir. Bu da büyük oranda tercihine neden olmaktadır.","In this study, flight tests, telemetry systems in flight tests and modulation on this subject are emphasized. Theoretical information about SOQPSK-TG, which was developed to meet the needs with the developing technology in this field, is given. The goal is to ensure that the aircraft from a telemetry station, using SOQPSK-TG modulation, is properly fabricated by flight testing and is in good condition for safe operations. Recently, SOQPSK modulation has been introduced as a bandwidth efficient modulation technique. The main advantage of these signals is better spectral efficiency. This causes a great deal of preference.",": modülasyon, telemetri, uçuş testi, SOQPSK, hava aracı","modulation, telemetry, flight test, SOQPSK, aircraft"
422,2021-2022,Statik Yükleme ve Titreşim Koşullu Bütünleşik Topoloji Optimizasyonu,Integrated Topology Optimization with Static Loading and Vibration Conditions,"Havacılık sektöründe, tasarımların yüksek mukavemetli ve aynı zamanda hafif olmaları önemli bir ihtiyaçtır. Bu nedenle, son zamanlarda topoloji optimizasyonu yöntemleri yaygınlaşmıştır. Topoloji optimizasyonu çalışmamalarında doğal frekans gereksinimlerinin karşılanması önemli tasarım öğelerinden biridir. Topoloji optimizasyonu statik bir sonlu eleman analizi değerlendirmesi gerektirirken, doğal frekans hesabı modal analiz değerlendirmesi gerektirir. Bu iki farklı analiz prosedürünü topoloji optimizasyonu sürecinde aynı anda kullanmak ise zorlu bir süreçtir. Bu probleme çözüm olması adına, bu çalışmada bir esneklik minimizasyon sürecinde doğal frekans kısıtlamasını hesaba katan bir topoloji optimizasyon metodolojisi sunulmaktadır. Ticari yazılımlar, bu iki farklı analiz prosedürünü kullanarak bir seferde ya statik olarak tanımlanan amaç fonksiyonunu en aza indirebilir ya da dinamik olarak tanımlanan amaç fonksiyonunu en aza indirebilir. Geliştirilen metodun durumu beraber değerlendirebilmesi çalışmanın yenilikçi bir yönü olarak öne çıkmaktadır. Geliştirilen metodolojinin uygulanabilirliği, doğal frekans ve kütle kısıtlamaları ile mühendislik uygulaması olarak bir uydu braketi ile gösterilmiştir. Tasarımların prototipleri, eklemeli imalat tekniği kullanılarak üretilmiştir.","The most important need in the aviation industry is the realization of high-strength and lightweight designs. For this reason, topology optimization methods have become widespread recently. Besides, meeting the natural frequency requirements is one of the important design elements. However, topology optimization requires a static finite element analysis evaluation while the natural frequency calculation requires a modal analysis evaluation. Using these two different analysis procedures at the same time in the topology optimization process, on the other hand, is a challenging task. To address this challenge, a topology optimization methodology that account for the natural frequency constraint in a compliance minimization process is presented in this study. Since the commercial software can either minimize compliance or minimize the vibration frequency at one time, using these two different analysis procedures at the same time together stands out as an innovative aspect of this study. The applicability of the developed methodology is shown with a real-world satellite bracket with natural frequency and mass constraints. The prototypes of the designs are fabricated using the additive manufacturing technique.","Topoloji optimizasyonu, doğal frekans, havacılık, eklemeli imalat","Topology optimization, natural frequency,"
428,2021-2022,İki Silindirli İçten Yanmalı Bir Motor İçin İtki Test Düzeneği Oluşturulması,Designing Thrust Test Rig for a Two Cylinder Internal Combustion Engine,"Hava araçlarındaki itki sistemleri büyük öneme sahiptirler. İtki sistemleri hava araçlarının hareketlerini ve manevra kabiliyetlerini sağlamalarında görev almaktadır. İtki sistemlerinin temel elemanlarından biri motordur. Havacılıkta kullanılan motorlar arasında turbofan, turbojet, turboprop ve pistonlu motorlar gösterilebilir. Turbofan ve turbojet motorlar yakıtın yanmasından kaynaklı itkiyi kullanırken, turboprop ve pistonlu motorlar, pervaneler kullanılarak itki üretmektedirler. Yapılan bu çalışmada iki silindirli DLE 120 modeli bir içten yanmalı pistonlu motorun itki testlerinin yapılabileceği bir test düzeneği tasarlanmış ve üretilmiştir. Bu düzenek sayesinde pervane ile üretilen itkinin ölçümü ve motorun açısal momentumundan kaynaklı olarak üretmiş olduğu torkun ölçümü gerçekleştirilebilecektir. Test düzeneği tasarımı Solidworks programı kullanılarak yapılmıştır. Tork ve itki ölçümleri 20 ve 50 kg ölçüm kapasitesine sahip yük hücreleri ile, egzoz gazı sıcaklıkları ise K tipi termokupllar ile ölçülebileceklerdir. Test düzeneğinde ölçülebilecek diğer bir parametre ise yakıt tüketimidir. Yakıt tüketimi hassas terazi kullanılarak ölçülecektir. Üretilen test düzeneği üzerinde gelecekte yapılacak geliştirmeler sayesinde TUSAŞ’ın da testlerini gerçekleştirebileceği bir düzenek oluşturulabilecektir.","Propulsion systems in aircraft are of great importance. Propulsion systems are involved in ensuring the movement and maneuverability of aircraft. One of the basic elements of propulsion systems is the engine. Among the engines used in aviation, turbofan, turbojet, turboprop and piston engines can be shown. Turbofan and turbojet engines use thrust from the combustion of fuel, while turboprop and reciprocating engines generate thrust using propellers. In this study, a test setup for thrust tests of a two-cylinder DLE 120 model internal combustion piston engine was designed and produced. Thanks to this setup, it will be possible to measure the thrust produced by the propeller and the torque produced by the engine's angular momentum. The test setup was designed using the Solidworks program. Torque and thrust measurements can be measured with load cells with a measurement capacity of 20 and 50 kg, and exhaust gas temperatures with K type thermocouples. Another parameter that can be measured in the test setup is fuel consumption. Fuel consumption will be measured using a precision scale. Thanks to the future developments on the test set-up, it will be possible to create a setup where TAI can also perform its tests.","içten yanmalı motor (İYM), itki, pervane, yakıt tüketimi.","internal combustion engine (ICE), thrust, propeller, fuel consumption."
434,2021-2022,Teknoloji Hazırlık Seviyesi Ölçüm Aracı Geliştirilmesi,Developing A Technology Readiness Level Assessment Tool,"Bir proje veya şirketin başarısı için yatırım yapılacak doğru teknolojileri seçme, yönetme, değerlendirebilme yeteneği oldukça önemlidir. Bu nedenle NASA, 1970'lerde, kuruluşların teknolojilerini yönetmelerini sağlayan Teknoloji Hazırlık Seviyesi (THS) adı verilen bir yöntem geliştirdi. Bu çalışmada ise literatür taraması yapılarak örnek metotlar ve çalışmalar incelendi. Ardından mevcuttaki uygulamaların eksik noktalarını geliştirmek üzere kullanıcı dostu bir yazılım oluşturuldu. Yöntem olarak AHP ( Analitik Hiyerarşi Prosesi) ve yazılım dili olarak Python kullanıldı.","The ability to choose, manage and evaluate the right technologies to invest in is very important for the success of a project or company. For this reason, NASA developed a method in the 1970s called the Technology Readiness Level (TRL), which allows organizations to manage their technology. In this study, a literature review was done and sample methods and studies were examined. Then, user-friendly software was created to improve the missing points of the existing applications. AHP (Analytic Hierarchy Process) was used as the method and Python was used as the software language.","THS, teknoloji hazırlığı, teknoloji olgunluğu","TRL, technology readiness, technology maturity"
440,2021-2022,Termoplastik Geri Dönüşüm,Thermoplastic Recycle,"Bu çalışma, havacılık sektörünün geleceği için yüksek önem taşıyan, dünyada ve ülkemizde yeni bir kullanım alanı olan termoplastik kompozit malzemelerin geri dönüşümü üzerine yapılmıştır. Mevcut kullanılan malzemelere göre hafiflik, üretim kolaylığı ve enerji gereksinimi gibi birçok konuda avantajlar sağlayan termoplastik malzemelerin kullanımı gün geçtikçe artmaktadır. Birçok havacılık yapısında kullanılacak olması beraberinde yüksek miktarda atık malzeme getireceğini gösterir. Bu projede, bu atıkların geri dönüştürülerek ham madde tedariği, depolama alanı ve bertaraf işlemleri gibi atık yönetimi sorunlarının ortadan kalkması hedeflenmiştir. Bu hedef doğrultusunda üretim hattından alınmış karbon fiber takviyeli PEKK malzemeden yapılmış rib üretim atıklarının mekanik geri dönüşümü gerçekleştirilmiş ve geri dönüştürülmüş ürün incelenmiştir. Elde edilen sonuçların umut verici olduğu görülmüştür.","This study was carried out on the recycling of thermoplastic composite materials, which is a new area of use and has a high potential for the aerospace industry. The use of thermoplastic materials, which provide advantages in many aspects such as lightness, ease of production, and energy requirement, is increasing day by day compared to existing materials. The fact that it will be used in many aerospace structures shows that it will bring a high amount of waste material. In this project, it is aimed to eliminate waste management problems such as raw material supply, storage area and disposal processes by recycling these wastes. In line with this goal, mechanical recycling of rib production waste made of carbon fiber reinforced PEKK material taken from the production line was carried out and the recycled product was examined. The obtained results were found to be promising.",termoplastik kompozit; PEKK; mekanik geri dönüşüm; karbon fiber,thermoplastic composite; PEKK; mechanical recycle; carbon fiber.
446,2021-2022,Tersine Benzetim Yöntemiyle Yükseliş ve Dalış Manevrasının İcrası,Execution of Pull up Push over Maneuver Using Inverse Simulation Method,"Bu çalışmada tersine benzetim yöntemiyle yükseliş ve dalış manevrasının icrası başlıklı konu ele alınmıştır. Konunun ana amacı sabit kanatlı bir hava aracının yükseliş ve dalış manevrasını gerçekleştirebilmek için sisteme hangi kontrol girdilerini uygulamak gerektiğini bulmaktır. Tersine benzetim yöntemleri olan optimizasyon, türev ve integral yöntemleri arasından integral yöntemiyle bu çalışma gerçekleştirilmiştir. İntegral metodu manevra ve modelden bağımsız bir algoritmaya sahip olduğu için tercih edilmiştir. Yükseliş ve dalış manevrası Ɵ(yunuslama) açısı ve hız parametrelerine bağlı olarak tanımlanmıştır. Sisteme sinüs dalgası olarak verilen Ɵ açısı takibi ve seyir uçuşu esnasındaki hızın manevra boyunca sabit tutulması hedeflenmiştir. Newton-Raphson iteratif yöntemiyle hava aracının belirli zaman adımları için kontrol çıktıları üretilmesi sağlanmıştır. Sisteme verilen Ɵ açısı girdisi ve sabit hız girdisi , durum uzay modelinin ürettiği çıktılar arasından bir fark olacaktır ve bu farka hata denir. Bu hata değerinin belirlenen tolerans değerinden küçük olması beklenmektedir. Aksi taktirde jacobian matrisi kullanılarak aynı zaman adımı için farklı kontrol inputları ile durum uzay modelini besleyerek Ɵ açısı ve hız değerlerinin istenen değerlere tolerans çerçevesinde yaklaşması beklenir. Bu çalışma Matlab/Simulink kullanılarak gerçekleştirilmiştir.","In this study, the subject of performing the pull up push over maneuver with the inverse simulation method has been studied. The main purpose of the topic is to find out which control inputs should be applied to the system in order to perform the pull up push over maneuver of a fixed wing aircraft. Among the inverse simulation methods, optimization, derivative and integral methods, this study was carried out with the integral method. The integral method is preferred because it has an algorithm independent of the maneuver and the model. The pull up push over maneuver are defined depending on the Ɵ (pitch) angle and velocity parameters. It is aimed to follow the Ɵ angle given to the system as a sine wave and to keep the speed during the cruise flight constant throughout the maneuver. With the Newton- Raphson iterative method, control outputs are produced for certain time steps of the aircraft. The Ɵ angle input and the constant velocity input given to the system will be a difference between the outputs produced by the state space model, and this difference is called error. This error value is expected to be smaller than the specified tolerance value. Otherwise, by feeding the state space model with different control inputs for the same time step by using the jacobian matrix, it is expected that the Ɵ angle and velocity values approach the desired values within the tolerance frame. This study was carried out using Matlab/Simulink.","Yükseliş ve dalış manevrası, tersine benzetim yöntemi, integral metodu, jacobian matris","Pull up and push over maneuver, inverse simulation method ,integration method, jacobian matrix"
452,2021-2022,Ticari Uçak Kanadı ve Yapısal Sağlık Takip Sistemi İçin Statik/Dinamik Test Düzeneği Tasarımı,Design of a Commercial Aircraft Wing and It’s Static/ Dynamic Test Rig for Structural Health Monitoring (SHM),"Yer Titreşim Testi (GVT), uçak sertifikasyon sürecinin bir parçasıdır ve ana amacı, yapısal dinamik modellerini doğrulamak ve iyileştirmek için tüm uçak yapısının deneysel titreşim verilerini elde etmektir. Bu modeller, çırpıntı davranışını tahmin etmek ve güvenlik açısından kritik uçuş testlerini planlamak için kullanılır. Bu projenin temel amacı, seçilen bir ticari uçak kanadının gerekli analizleri yapıldıktan sonra elde edilen değerlerle uygun bir yer titreşim test cihazı tasarlamaktır. Analizde kullanılmak üzere seçilen ticari uçak kanadı, NASA ve Boeing Company iş birliğiyle araştırmalarda kullanılmak üzere tasarlanmış Ortak Araştırma Modeli’ dir. Bu model kullanılarak aerodinamik, modal, yapısal ve aeroelastik analizler yapılacaktır. Analizler sonucunda elde edilen değerler, statik/dinamik test düzeneği tasarımında tasarım parametreleri olarak kullanılacaktır.","Ground Vibration Testing (GVT) is part of the aircraft certification process, and its main purpose is to obtain experimental vibration data of the entire aircraft structure to validate and improve structural dynamic models. These models are used to predict flutter behavior and to plan safety-critical flight tests. The main purpose of this project is to design a suitable ground vibration test equipment with the values obtained after the necessary analysis of a selected commercial airplane wing. The commercial airplane wing chosen for use in the analysis is the Joint Research Model designed for use in research in collaboration with NASA and Boeing Company. By using this model, aerodynamic, modal, structural and aeroelastic analyzes will be made. The values obtained because of the analyzes will be used as design parameters in the static/dynamic test setup design.","yer titreşim testi, ortak araştırma modeli, hesaplamalı akışkanlar dinamiği (HAD), yapısal analiz, modal analiz, aeroelastik analiz, çırpıntı tahmini.","ground vibration test (GVT), common research model (CRM), computational fluid dynamics (CFD), structural analysis, modal analysis, aeroelastic analysis, flutter prediction."
456,2021-2022,Transmisyon Üretim Hattında Çizelgeleme,Production Scheduling in a Transmission Production Line,"Bu rapor, TUSAŞ'ın Ankara-Kahramankazan'daki fabrikasında transmisyon detay üretim hattının üretim takvimini oluşturmak için yapılan araştırma ve projelendirmeyi özetlemektedir. Projenin temel amacı, TUSAŞ bünyesinde önümüzdeki yıllarda gerçekleşmesi planlanan üretim artışı için optimum parti boyutunu belirlemek ve bir üretim programı oluşturmaktır. Bunun için şanzıman üretim hattı sürecini araştırdık ve optimize etmeyi planlanmıştır. Sezgisel çözüm yöntemleri için önce matematiksel bir model oluşturulmuştur. Bu modelin Microsoft Excel Çözücü'de 4 makine ve 2 parça için birkaç işlemle çalışıp çalışmadığını test edilmiş ve GRG Nonlinear motorunu kullanarak geliştirilen modelin küçük ölçekte çalıştığı ispat edilmiştir. Daha sonra genetik algoritmayı modele uygulamaya başlanmıştır. Python ile genetik algoritma çalışmaları için kromozom-gen yapımızı oluşturulmuştur. Çaprazlama ve mutasyon yapılarak en iyi ebeveynleri bulmak için bir uygunluk fonksiyonu oluşturulmuştur. Daha sonra 500 nesil boyunca tekrarlanarak minimum makespan bulunmuştur.","This report summarizes the research and project planning done to create a production schedule for the transmission detail production line in TUSAŞ's factory in Kahramankazan, Ankara. The main purpose of the project is to determine the optimum batch size for the planned increase in production to be realized in the coming years within TUSAŞ, as well as to create a production schedule. For this, we have explored and plan to optimize the process of the transmission production line. We decided to first create a mathematical model for the heuristic solution methods. We tested whether this model works in Microsoft Excel Solver for 4 machines and 2 pieces with several operations and found a solution using the GRG Nonlinear engine, showing the model we’ve developed so far does work on a small scale. We then began applying the genetic algorithm to our model. We created our chromosome-gene structure for our genetic algorithm studies with Python. We generated a fitness function to find the best parents, with which we did crossover and mutation. After repeating this for 500 generations, we found the minimum makespan.","Transmisyn üretim hattı, üretim planlama, çizelgeleme problemi, sezgisel yöntemler, matematiksel modelleme, Excel Çözücü, Genetik Algoritma, Makespan","Transmission line, production planning, scheduling"
