PageNumber,Year,Title_TR,Title_EN,Abstract_TR,Abstract_EN,Keywords_TR,Keywords_EN
228,2021-2022,"Kavite Aktif Akış Kontrolü İçin Aeroakustik Analizler, Boyutlandırma ve Maliyeti de İçeren Sistem Tasarımı","System Design Including Aeroacoustic Analysis, Sizing and Cost for Active Flow Control Inside a Cavity","Bir hava aracının seyir halindeyken çıkardığı gürültü, birden fazla sebepten dolayı kritik önem arz etmektedir. Bunlardan ilki, hava aracının seyir halinde bulunduğu bölgede oluşturduğu gürültü kirliliğidir. Bir diğeri, stratejik öneme sahip hava araçlarının akustik olarak fark edilebilirliğinin artmasıdır. Ayrıca bu gürültü, basınç dalgalanmaları sebebi ile oluştuğundan, yapısal parçaların üzerindeki yüklerin de dalgalanması anlamına gelir ki yüksek hızlı hava araçları için bu kuvvetler kritik öneme sahiptir. Günümüz hava araçlarının sahip olduğu iniş takımı aksamı ve mühimmatların bulunduğu bölmelerin sahip olduğu kavite geometrisi, özellikle bu bölgelerin açık olduğu durumda yüksek miktarda akış dalgalanmalarına sebep olmaktadır. Bu dalgalanma sebebi ile yüksek miktarda gürültü oluşmaktadır. Bu probleme çözüm olarak öncelikle bu bölgelerdeki akışın fiziği anlaşılmaya çalışılmış ve kontrolsüz kavite akışı analizleri yapılmıştır. Gürültüye sebep olan mekanizma anlaşıldıktan sonra ise aktif akış kontrol sistemi ile gürültünün azaltılması üzerine çalışılmıştır. Yapılan çalışmada, kavite yukarı akım bölgesinden akışkan enjekte ederek gürültü kontrolü sağlayan verimliliğini etkileyen parametreler incelenmiştir. Bu parametreler, kontrol akışı giriş alanının en- boy oranı, kontrol jetinin hızı ve kontrol jetinin çıkış açısıdır. Sıkıştırtılabilir ve zamana bağlı akış için türbülans modeli olarak Detached Eddy Simulation (DES) kullanılarak analizler yapılmıştır. Kavite yukarı akım bölgesine yerleştirilen kavite genişliğinde slot geometrisinin kontrol için en verimli konum ve geometri olduğuna karar verilmiş, bu geometri içerisinden 90 derece açı ve 0.9 hız oranına sahip jetin en verimli kontrolü sağladığı görülmüştür.","The noise made by an aircraft while cruising is critical for more than one reason. First one is the noise pollution that the aircraft creates in the area where it is cruising. Another one is the increase in acoustic detectability of strategically important aircraft. Also, since this noise is caused by pressure fluctuations, it means that the loads on the structural parts fluctuate as well, which is critical for high-speed aircrafts. The cavity geometry of the compartments containing the ammunition and the landing gear components of today's aircraft cause flow fluctuations, especially when these areas are open. Due to this fluctuation, undesired noise is generated. As a solution to this problem, firstly, the physics of the flow in these regions was understood and uncontrolled cavity flow analyzes were performed using Computational Fluid Dynamics (CFD). After that, the development of an active noise control system was studied. In the study, parameters affecting the efficiency of noise control by injecting fluid from the cavity upstream region were investigated. These parameters are the aspect ratio of the control flow inlet area, the speed of the control jet and the exit angle of the control jet. In the light of the values obtained as a result of the CFD analyzes, the cavity upstream region is the most suitable region for active control flow. The slot-shaped entrance zone geometry is the most efficient for active control. It has been observed that the jet with 90 degree angle and 0.9 velocity ratio provides the most efficient control.","kavite, aktif akış kontrolü, jet enjeksiyonu, gürültü baskılama, DES.","cavity, active flow control, jet injection, noise"
234,2021-2022,Production Area of TUSAŞ,Kimyasal Üretim Alanlarında İlgili Süreçlerin İncelenerek Darboğazların ve Kapasitenin Belirlenmesi Capacity and Bottleneck Analysis of Chemical,"Bu çalışma kapsamında kimyasal üretim alanlarında kapasite planlama çalışmaları için bir metodoloji geliştirilmiştir. Geliştirilen metodoloji kapsamında ilgili süreçler incelenerek veriler toplanılmış, toplanılan veriler analiz edilerek simülasyon çalışmasında kullanılmıştır. Yapılan simülasyon çalışması sonucunda ise ilgili alanın çalışma süresi ve darboğazlar belirlenmiştir.","Within the scope of this study, a methodology has been developed for capacity planning studies of chemical production areas. Within the scope of the developed methodology, data were collected by examining the relevant processes, and the collected data was analyzed and used in the simulation study. As a result of the simulation study, the working time of the relevant area and the bottlenecks were determined.","Havacılık, Kimyasal Süreç, Kapasite Analizi, Darboğaz, Kapasite Planlama","Aviation Industry, Chemical Process, Capacity Analysis, Bottleneck, Capacity Planning"
240,2021-2022,Kuş Çarpmasının Bir Savaş Uçağı Kanopisinin Yapısal Bütünlüğüne ve Radar Kesitine Etkisinin İncelenmesi,Investigation of the Effect of the Bird Strike on the Structural Integrity and Radar Section of a Fighter Plane,"Bu çalışma, bir savaş uçağının kanopisine kuş çarpmasının yapısal ve radar kesit alanı üzerindeki etkilerini araştırmaktadır. Bu çalışmada, İnterpolasyonlu Parçacık Hidrodinamiği (Smoothed Particle Hydrodynamics, SPH) olarak Türkçe ’ye çevirebileceğimiz sonlu elemanlar yaklaşımı kullanılarak yarı küresel uçlu silindirik geometriye sahip kuş modelleri simüle edilmiş ve çözümlemeler yapılmıştır. Kanopiye kuş çarpması LS-DYNA yazılımı kullanılarak modellenmiş ve sonuçlar literatürde mevcut olan deneysel ve nümerik verilerle karşılaştırılmıştır. Çalışmanın ilerleyen aşamalarında, kanopinin radar kesit alanı CST programı ile simüle edilerek üzerinde hesaplanmıştır. Sonraki adımda, kanopinin mevcut tasarım kriterleri içinde kalarak farklı tasarım seçenekleri değerlendirilmiş ve sonuçlar hem yapısal hasar hem de radar kesit alanı olarak karşılaştırılmıştır. Son olarak, elde edilen veriler neticesinde küçük radar kesit alanına sahip ve geometride en iyileme yapılarak, yapısal olarak en dayanıklı ve radar kesit alanı en küçük geometri belirlenmiştir.","The aim of this project is to examine the effect of a bird strike on the structural integrity and radar cross-section of a fighter aircraft canopy. In this study, bird models with hemispherical-ended cylindrical geometry are simulated using the Smooth Particle Hydrodynamics (SPH) finite element approach. Bird strike to the canopy is modeled using LS-DYNA software and the results are compared with experimental and numerical data available in the literature. In the later stages of the study, the radar cross-sectional area of the canopy is calculated using CST software. Then, different design options are evaluated within the current design criteria of the canopy and the results are compared in terms of both structural damage and radar cross- sectional area. Finally, the design option that has the smallest radar cross-sectional area and structurally durable is determined as the optimum canopy design for this study.",Radar Kesit Alanı; Kuş Çarpması; Kanopi; Sonlu Elemanlar Analizi.,Radar Cross Section; Bird Strike; Canopy; Finite Element Analysis.
246,2021-2022,Kafes Yapılarının Hava Aracı Bileşenlerinin Tasarımını Sağlayan Tasarım Modülü Geliştirilmesi,Developing a Design Module that Enables the Use of Lattice Structures in Aircraft Components,"Bu çalışmada, eklemeli imalat yöntemleri ile üretilmek üzere yapısal parçaların kafes yapıları ile daha hafif şekilde tasarlanmasını sağlayan tasarım modülü geliştirilmesine yönelik çalışma gerçekleştirilmiştir. Kafes yapıları (Lattice) ile yapısal parça tasarımında mevcut tasarım programlarının tasarımda yer alan tüm çubuk elemanlarının tek bir yapı eleman olarak tasarlaması, her bir çubuk elemanının parametrelerinin değiştirilmesine imkân sağlamamaktadır. Gerçekleştirilen çalışma ile TUSAŞ bünyesinde yapılacak optimizasyon çalışmaları için gerekli tasarım verileri oluşturulmaktadır. Elde edilen tasarım verilerinde; kafes yapılarının türleri, kafes yapılarında çubuk elemanlarının çapları, gradyan sıklığı, yazdırma tablası düzlemi ile çubuk elemanlarının yaptığı açı (overhang açısı) müdahale ederek kullanılacak parçaların yükleme tipine uygun şekilde daha hafif kafes yapılı tasarımların elde edilmesi amaçlanmıştır. Çalışmada Siemens NX tasarım programı bünyesinde yer alan SNAP programlama dili kullanılarak, kafes yapılarının tasarımını ve eklemeli imalat destek yapısı olarak kullanılmasını sağlayan tasarım modülü geliştirilmesi yapılmıştır. Çalışma kapsamında kafes yapılarının şeçilmesinde kullanıcıya fikir vermesi ve şeçimi kolaylaştırması amacıyla 7 farklı tipteki kafes yapısı için yapısal analizler gerçekleştirilmiştir. Analizlerde her bir kafes yapısının hacmi eşit olması amacıyla farklı çap değerlerinde tasarlanmıştır. Çalışmamız TÜBİTAK 2209’dan destek almıştır, LIFT UP kapsamında geliştirmiş olduğumuz programdan elde edilen çıktının üretimi sağlayarak mekanik testlerin gerçekleştirilmesi hedeflenmektedir.","This study has been carried out to develop a design module that enables the structural parts to be designed with lattice structures in a lighter way to be produced using additive manufacturing methods. The fact that all the strut elements in the design of the current design programs in the design of lattice structures (Lattice) and structural parts are designed as a single structural element does not allow the parameters of each bar element to be changed. With the work carried out, the necessary design data for the optimization studies to be carried out within TA","Kafes yapı, Eklemeli İmalat, Tasarım, SNAP",
252,2021-2022,Makine Öğrenme ve Yapay Zeka Sistemlerinin Doğrulanması ve Onaylanması,Verification and Validation of Machine Learning and Artificial Intelligence Systems,"Bu çalışmanın amacı, havacılık sektöründe Makine Öğrenimi ve Yapay Zeka uygulamaları için tamamen güvenilir sonuçlar elde ederek güvenilir bir kullanım alanı oluşturmak olduğundan, bir MÖ&YZ modeli eğitilir, test edilir ve çıktıya göre gerekli gözlem ve analizler yapılır. Eğitimli ve test edilmiş sistem, daha sonra, sinir ağı kurulumunun doğru olup olmadığını kontrol etmek için doğrulamanın kullanıldığı ve nihai ürünün yazılımının ihtiyaçlarını karşılayıp karşılamadığını kontrol etmek amacıyla Doğrulama ve Onaylama için gerekli önermeler yapılır. Bu amaçla veri setinin girdi olarak alınması, nesne tespiti, nesne sınıflandırması, MÖ&YZ modelinin analizleri, doğrulama ve onaylama aşamaları uygulanmaktadır. Proje, güvenlik açısından kritik sistemler için güvenilirlik olasılığını artırmak için gerekli öneriler, veri setine dayalı gözlemler, eğitim ve test seçeneklerini içermektedir. Proje sonucunda, daha az fotoğrafa sahip sınıfın daha düşük algılama olasılığına sahip olduğu, daha fazla sayıda fotoğraf içeren bir veri kümesinin diğer veri kümelerinin tahmin mekanizması üzerinde zararlı bir etkiye sahip olduğu ve veri kümesindeki görüntülerin kalitesinin çok önemli olduğu gözlemlendi. Verilerin farklı çekim ve görüntü işleme özellikleri kullanılarak eğitilmesi, tahmin olasılığını artırmaktadır. Havacılık sektöründe kullanılan kameralar hem gündüz hem de gece çalıştığından, kızılötesi ışık kullanılarak alınan görüntüler termal kameralar söz konusu olduğunda avantajlı olabilir. Farklı sınıf türlerini kapsayan grup fotoğraflarının uygulanması, sistem verideki bu nesneleri öyle olmasa bile tek bir sınıf olarak kabul ettiğinden, eğitimi karıştırabilir. İlgili nesnenin farklı perspektiflerinden nesne görüntülerini içeren sınıflar, daha yüksek nesne algılama ve sınıflandırma olasılık yüzdesine sahip olduğu fark edildi. MÖ&YZ sistemlerini eğitmek ve oluşturmak için en uygun bölme yüzdesi kullanılmalıdır.","Since the goal of the project is to create a reliable field of usage for Machine Learning and Artificial Intelligence applications in the aviation industry by obtaining entirely dependable results, an ML&AI model is trained, tested, and necessary observations and analyses are done according to the output of the trained and tested system, then requisite proposals for Verification and Validation are done where the verification is employed to check whether the path taken is correct and validation is applied to check whether the software of the final product meets its needs. For this purpose, importing dataset, object detection, object classification, analyses of ML&AI model, verification & validation phases applied. As a result of the project, necessary proposals to increase the probability of security for safety critical systems, include observations based on the dataset, training, and testing options. It is discovered that the class with fewer photos has a lower detection probability, a dataset that comprises a larger number of photos has a detrimental influence on the prediction mechanism, and the quality of images in the dataset matters so much. Training the system with district shooting and image processing features increases the probability of prediction. Images taken by utilizing infrared light may be advantageous in the case of thermal cameras since cameras used in the aviation industry, work both day and night. Application of group photos meaning enclosing different types of classes may confuse training since the system considers all of these objects as one class even though they are not. Classes containing object images from different perspectives of the related object have a greater object detection and classification probability percentage. The best-fitted splitting percentage should be used to train and create the ML&AI systems.","Aviyonik, İnsansız Hava Araçları, Makine Öğrenme, Yapay Zeka, Nesne Algılama, Görüntü Sınıflandırma, Doğrulama, Onaylama.","Avionics, Unmanned Aerial Vehicles, Machine Learning, Artificial Intelligence, Object Detection, Image Classification, Verification, Validation."
258,2021-2022,Eklemeli İmalat ile Üretilen AlSi10Mg Bazlı Ürünlerde Mikroyapı – Mekanik Özellik İlişkisi,Microstructure – Mechanical Property Relationship in Additively Manufactured Products with AlSi10Mg Based Material,"Bu çalışmada, toz yatakta füzyon yöntemiyle üretilmiş AlSi10Mg alaşımının, mekanik özellik, kırılma mekanizması ve mikroyapı ilişkileri kurulmuştur. Lazer toz yatak füzyon tekniği yenilikçi bir eklemeli imalat yöntemidir. Eklemeli imalat gelecek vadeden üretim tekniği olduğundan dolayı, kullanılan malzemelerin mekanik özelliği, kırılma mekanizması ve mikroyapısı araştırılmaya gereksinim duymaktadır. Bu nitelikler, istenilen parça üretimine karar verirken büyük bir önem arz etmektedir. Amacımız için elastisite, plastisite, dayanım, tokluk, gevreklik, süneklik ve darbe özellikleri incelenmiştir. AlSi10Mg numunelerinin bu mekanik özelliklerini ortaya çıkartabilmek için; çekme testi, Charpy darbe testi, sertlik testi ve yoğunluk testi uygulanmıştır. Daha sonra, kırılma mekaniği ve mikroyapı, optik mikroskop ve tarayıcı elektron mikroskobu ile gözlemlenmiştir. En sonunda da bu sonuçlar birbirleriyle ilişkilendirilmiştir. Sonuç olarak, lazer toz yatak füzyon birleştirme eklemeli imalat metodu ile üretilmiş AlSi10Mg alaşımı, yapılan Çekme testi, Charpy darbe testi ve incelenen kırılma mekanizması neticesinde hem sünek hem de gevrek bir özellik göstermiştir. Öte yandan, Eklemeli imalatla üretilmiş AlSi10Mg, literatürdeki dökümle üretilmiş AlSi10Mg ile kıyaslandığında daha yüksek akma mukavemetine, çekme mukavemetine, mikrosertliğe ve daha az yoğunluğa sahip olduğu belirlenmiştir.","In this thesis, the mechanical property, fracture mechanism, and microstructure relationship of AlSi10Mg produced by laser powder bed fusion were established. Laser powder bed fusion is an additive manufacturing method that is an innovator technique. Since additive manufacturing is a new technique, utilizing materials requires studies investigating the mechanical properties, fracture mechanism, and microstructure. This is vital because these characteristics are used before choosing the materials to manufacture the desired parts. Elasticity, plasticity, strength, toughness, brittleness, ductility, and impact were investigated for this purpose. The tensile test, the Charpy impact test, the hardness test, and the density test were applied to identify the mechanical properties of AlSi10Mg specimens. After that, fracture mechanics and microstructure of the material were observed via an optical microscope and a scanning electron microscope. Finally, these results were related to each other. As a result of tensile, Charpy impact test results and fracture mechanisms, laser powder bed additively manufactured AlSi10Mg alloy exhibited ductile-brittle transition material. As- built additively manufactured AlSi10Mg demonstrated higher yield strength, ultimate tensile strength, microhardness but less density than as-built cast-produced AlSi10Mg.",Eklemeli imalat; AlSi10Mg; mekanik özellik; mikroyapı; kırılma mekaniği.,"Additive manufacturing; AlSi10Mg; mechanical property; microstructure, fracture mechanics."
264,2021-2022,Elektron Işını Eritilmiş ve Seçici Lazer Eritilmiş “Ti-6Al-4V” Arasındaki Temel ve Kritik Farklar (Mikroyapı ve Gerilme Özellikleri),Main and Critical Differences (Microstructure and Tensile Properties) Between Electron Beam Melted and Selective Laser Melted “Ti-6Al-4V”,"SLM ve EBM Ti–6Al–4V numunelerinin mikroyapıları ve mekanik özellikleri üç parametre kullanılarak incelendi ve Taguchi L6 kullanılarak bir deney tasarımı oluşturuldu. Mikroyapıyı nelerin etkilediği, kusurlar ve çekme özelliklerini nasıl etkilediği açıklığa kavuşturuldu. SLM ve EBM ile üretilen numunelerindeki fazların çoğu sırasıyla α' ve α + β fazlarıydı. SLM ve EBM numunelerindeki birincil kusurlar, tarama teknikleri ve enerji girişi ile yüksek oranda ilişkili olan gözeneklerdi. EBM numunelerine kıyasla, SLM numunelerinin daha yüksek bir gözenekliliği vardı. Hem SLM hem de EBM numunelerinde yüksek mukavemet görülmüştür.","SLM and EBM Ti–6Al–4V samples' microstructures and mechanical characteristics have been examined using three parameters and constructing a design of experiment using Taguchi L6. It was clarified what affected the microstructure, flaws, and how they affected the tensile properties. The majority of the phases in the as-fabricated SLM and EBM samples, respectively, were α′ and α + β phases. The primary flaws in SLM and EBM samples were pores, which were highly correlated with scanning techniques and energy input. In comparison to EBM samples, SLM samples had a higher porosity. High strength values were seen in both the SLM and EBM samples.",SLM; EBM; Çekme testi; Mikroyapı İncelemesi.,SLM; EBM; Tensile Test; Microstructre Investigation.
270,2021-2022,Elektron Işın Ergitme Yöntemi Üretim Parametreleri ile Ti-6Al-4V Alaşımının Karakterizasyonunun İncelenmesi,Investigation of Electron Beam Melting 3D Printing Parameters for Ti-6Al-4V Alloys,"Titanyum ve alaşımlarının havacılık, denizcilik ve diğer mühendislik endüstrilerinde birçok uygulaması vardır. Elektron ışın ergitme (EBM), metallerin eklemeli imalat teknolojilerinden biri olarak yenilikçi bir endüstriyel imalat teknolojisi olarak kabul edilmektedir. EBM teknolojisi için en yaygın uygulamalar teknolojik, hafif, karmaşık parçalar üretmenin etkili bir yolunu sunduğundan, tıp ve havacılık endüstrilerinde bulunabilir. Avantajları arasında, parça tasarımı için yüksek derecede serbestlik ve bu işlemlerle elde edilen Ti-6Al-4V parçalarının artışını açıklayan küçük malzeme kaybı vardır. Katmanlı imalat tekniğine dayalı olarak, üretilen parçalar 3D hesaplamalı tasarım yöntemi kullanılarak bir toz yatak üzerinde üretilebilir. Ergitme işlemi bir vakum ortamında gerçekleştiğinden, EBM teknolojisi, özellikle titanyum alaşımı kullanıldığında, seçici lazer ergitme (SLM) ile karşılaştırıldığında daha yüksek yoğunluklu parçalar üretebilir. Bu çalışmada EBM tarafından üretilen Ti-6Al-4V alaşımının üretim parametrelerinin (elektron ışınını 5mA ‘dan 15mA’ya) numune yüzeyinin metal optik mikroskobu, taramalı elektron mikroskobu, X-ışını kırınımı ve enerji dağılım spektroskopisi (EDS) kullanılarak yüzey pürüzlülüğü, çentik darbe testi yapılarak mikroyapısının etkisini değerlendirmektir.","Titanium and its alloys have many applications in the aerospace, marine and other engineering industries. Electron beam melting (EBM) is recognized as an innovative industrial manufacturing technology as one of the additive manufacturing technologies of metals. The medical and aerospace industries are the most common users of EBM technology, as it provides a cost-effective solution to make lightweight, complicated parts. The advantages include a high degree of design freedom and little material loss, which explains why these techniques produce more Ti-6Al-4V parts. The manufactured items can be made on a powder bed utilizing the 3D computational design approach, which is based on the additive manufacturing technology. EBM technology can produce parts with higher density than selective laser melting (SLM), especially when titanium alloy is utilized, because melting takes place in a vacuum environment. In this study, the production parameters of the Ti-6Al-4V alloy produced by EBM (electron beam from 5mA to 15mA) of the sample surface were determined by metal optical microscopy, scanning electron microscopy, charpy impact testing, X-ray To evaluate the effect of surface roughness and microstructure using beam diffraction and energy dispersion spectroscopy (EDS).","Ti-6Al-4V, Eklemeli İmalat, EBM, Mikroyapı, Karakterizasyon","Ti-6Al-4V, Additive Manufacturing, EBM, Microstructure, Characterization"
276,2021-2022,Metal Bond Parçalarının Organik ve İnorganik Yüzey Kaplamalarının Parça Yapışmasına ve Kalitesine Etkisi,The Effect of Organic and Inorganic Surface Coatings of Metal Bond Pieces on Part Adhesion and Quality,"Adhesive Primer adı verilen yapıştırma teknolojisinin metal parçaların yapıştırılmasında kullanılması havacılık endüstrisine birçok yönden fayda sağlamaktadır. Düşük maliyetlidir, hafiftir ve yapıştırılan yüzeyler arasında homojen gerilim dağılımına izin vererek korozyona karşı kuvvetli direnç sağlar. Adhesive primer sahip olduğu uygulama süreçleri bakımından geliştirilmeye açıktır. Mevcut projede, adhesive primer etkinliğinin arttırılması ve primer uygulaması sırasında yaşanan sorunların önüne geçilmesi amaçlanmıştır. Ek olarak, bu bildiri metal bond parçalarının yapışma kalitesinin arttırılmasına yönelik yapılan deneysel çalışma yöntemi verilerini ve üretim sahasındaki uygulama süreçlerinin takibini içerir. Elde edilen sonuçlara bağlı olarak iyileştirme önerilerine yer verilmiştir.","The use of the adhesive technology called “Adhesive Primer” for bonding metal parts provides benefits to the aviation industry in many ways. It is low cost, lightweight and provides a strong resistance to corrosion by allowing homogeneous stress distribution between the bonded surfaces. Adhesive primer is open to development in terms of its application processes. In the current project, it is aimed to increase the effectiveness of the adhesive primer and to prevent the problems experienced during primer application. In addition, this paper includes experimental study method data for improving the adhesion quality of metal bond parts and the follow-up of the application processes in the production area. Depending on the results obtained, improvement suggestions are given.","Metal Bond, Parça Yapışması, Adhesive Primer, Korozyon, Yüzey Kaplamaları, Kalite, Anodize.","Metal Bond, Part Adhesion, Adhesive Primer, Corrosion, Surface Coatings, Grade, Anodized."
