PageNumber,Year,Title_TR,Title_EN,Abstract_TR,Abstract_EN,Keywords_TR,Keywords_EN
120,2021-2022,Gerçek Zamanlı İşletim Sistemlerinin Yüksek Güvenilirlikli Uygulamalarda Kullanımı İçin Yol Haritası Örneği Oluşturulması,Example of Roadmap for Use of Real-Time Operating Systems in High Reliability Applications,"Havacılık, uzay, otomotiv gibi yüksek güvenilirlik gerektiren yazılım uygulamalarında gerçek zamanlı işletim sistemleri kullanılmaktadır. Gerçek zamanlı işletim sistemleri, sistemin kesin olarak tanımlanmış bir süre içinde belirli bir olaya yanıt verme gereksinimlerini karşılamak için kullanılmaktadır. Bu çalışmada, gerçek zamanlı işletim sistemlerinin hangi gereksinimlere sahip olduğu ve bu gereksinimleri nasıl sağlayabildiklerinin test senaryoları ile gerçek zamanlı işletim sistemlerinin doğrulama yöntemleri incelenmiştir. FreeRTOS işletim sistemi kullanılarak yazılımları geliştirilen test senaryoları için test otomasyon ortamı tasarlanmıştır. Yüksek güvenlik gerektiren sertifiye / kalifiye yazılımlar için sertifikasyon süreçleri araştırılmıştır. Bu çalışma ile gerçek zamanlı işletim sistemlerini yüksek güvenilirlikli uygulamalarda kullanımı için yol haritası örneği oluşturulmuştur.","Real-time operating systems are used in software applications that require high reliability such as aviation, space and automotive. Real-time operating systems are used to meet the system's requirements to respond to a specific event within a strictly defined period of time. In this study, test scenarios and verification methods of real-time operating systems are examined which requirements of real-time operating systems and how they can meet these requirements. A test automation environment has been designed for test scenarios whose software is developed using the FreeRTOS operating system. Certification processes have been researched for certified / qualified software that requires high security. In this study, a roadmap example was created for the use of real-time operating systems in high-reliability applications.","Gerçek zamanlı işletim sistemleri, Yüksek Güvenilirlikli Yazılımlar, FreeRTOS, Yazılım testi ve doğrulaması.","Real-time operating systems, High Reliability Software, FreeRTOS, Software testing and verification."
126,2021-2022,Gerçek Zamanlı Veri İşleme Altyapısı,Real-Time Data Processing Infrastructure,"Farklı kaynaklardan eş zamanlı olarak toplanan verilerin gerçek zamanlı olarak elde edilmesi ve zaman etiketlenmesi, test altyapıları ve dijital ikiz uygulamalarında büyük önem taşımaktadır. Farklı kaynaklardan gelen veriler farklı frekanslarda olabilir ve zaman etiketleme, verilerin aynı zaman alanına aktarılmasını sağlayacaktır. Bu kapsamda standart PC, Raspberry Pi, linux tabanlı bilgisayarlar gibi farklı cihazlarda çalışabilen bir veri toplama yazılım altyapısı ile gerekli paket kütüphaneleri oluşturulması amaçlanmıştır. Bu amaçlar dikkate alınarak kapsamlı bir literatür taraması yapılmış ve bilgisayar ortamında, 3 adet farklı veri kaynağından verilerin üretilmesi ve zaman etiketlenmesi simüle edilmiştir.","Data acquisition and time stamping of the data that is being collected from different sources simultaneously in real time has a big significance in test infrastructures and digital twin applications. Data coming from different sources might be in different frequencies, and time stamping will enable transferring data into the same time space. In this context, it is aimed to create the necessary package libraries with a data collection software infrastructure that can run on different devices such as standard PC, Raspberry Pi, linux-based computers. Considering these purposes, a comprehensive literature review was made and the generation of data from 3 different data sources and time stamping were simulated in the computer environment.",zaman etiketlenmesi; veri; sensör; simülasyon; dijital ikiz.,time stamping; data; sensor; simulation; dijital twin.
130,2021-2022,"Gerçek Zamanlı, Akıllı Veri Toplama Altyapısı Dizaynı",Design of Real-Time and Smart Data Acquisition Infrastructure,"Günümüzde dijital teknolojinin gelişmesiyle verinin ve verilerden yapılan analizlerin önemi artmaktadır. Özellikle gerçek zamanlı veri toplama gereksinimi bulunan hava araçlarında, gerçek zamanlı toplanan veriler üzerinde yapılacak analizler ile sonraki uçuşların güvenliği ve verimliliğini arttırmak mümkün hale gelmektedir. Havacılıkta kullanılan test altyapılarında ve Dijital İkiz uygulamalarında, hava araçlarının farklı kaynaklarından farklı frekanslarla gerçek zamanlı olarak toplanan verilerin zaman etiketlerinde meydana gelen kaymalar yapılan analizlerde sorunlara yol açmaktadır. Disiplinlerarası bu çalışmada, ağdan gelen verileri direkt donanımda hızlandırabilen yeni nesil akıllı ağ adaptörlerdeki (SmartNIC) yaklaşımdan yola çıkarak gerçek zamanlı, akıllı bir veri toplama altyapısı tasarımı oluşturulmuştur. Altyapı için toplanacak olan uçuş verileri PX4 simülasyon ortamından sağlanmaktadır. Uçuş ile gerçek zamanlı olarak elde edilen veriler UDP haberleşme protokolü ile FPGA üzerinde bulunan ARM işlemci tabanlı yeniden yapılandırılabilen yonga-üzeri-sistem (SoC) mimarisine alınmaktadır. Uçuş verileri atomik saat havuzundan Ağ Zaman Protokolü (Network Time Protocol , NTP) aracılığıyla yüksek doğruluk ve hassasiyette üretilen zaman bilgisi periyodik olarak senkronize edilerek aynı zaman alanına taşınmıştır. Zaman etiketi verilerek hafıza birimine kaydedilecek verilerin güvenliğini artırmak için Advanced Encryption Standard (AES) kriptografik algoritması ve Elliptic-Curve Diffie-Hellman (ECDH) anahtar değişim mekanizmalarından oluşan hibrit şifreleme sistemi oluşturulmuştur. İçerdiği yoğun ve karmaşık hesaplamalardan dolayı yavaş çalışan şifreleme işlemi donanımsal olarak FPGA tabanlı SoC üzerinde gerçeklenerek hızlandırılmıştır. Unity3D oyun motoru ile tasarlanan ve birçok işletim sistemine uyumlu kullanıcı arayüzü ve üç boyutlu görselleştirme yapılarak, zengin bir analiz imkanı sunulmaktadır.","The importance of data and data analysis nowaday is increasing with the development of Digital Twin technologies. Especially, in aircraft that require real-time data acquisition, it becomes possible to increase the safety and efficiency of subsequent flights with the analysis to be made on the data collected in real-time. In the test infrastructures and Digital Twin applications used in aviation, the shifts in the timestamps of the data collected in real-time with different frequencies from different sources of the aircraft cause problems in the analysis. In this interdisciplinary study, a real-time and smart data acquisition infrastructure has been designed based on the approach of a new generation Smart Network Interface Card (SmartNIC), which can accelerate data coming from the network directly on the hardware. The flight data to be acquired for the infrastructure is provided from the PX4 simulation environment. The data acquired in real-time with the flight is transferred via the UDP communication protocol to the ARM processor-based reconfigurable system-on-chip (SoC) architecture on the FPGA. Time information produced with high accuracy and precision from the atomic clock pool via Network Time Protocol (NTP) of flight data was periodically synchronized and moved to the same time domain. A hybrid encryption system consisting of Advanced Encryption Standard (AES) cryptographic algorithm and Elliptic- Curve Diffie-Hellman (ECDH) key exchange mechanisms has been generated to increase the security of data to be recorded in a memory unit by timestamping. The encryption operation, that contains intensive and complex calculations, works slowly on standard processors, has been accelerated on the FPGA-based SoC hardware platform. The user interface and 3D visualization has been designed with the Unity3D game engine, which is compatible with many operating systems, provide a rich analysis opportunity.",Dijital İkiz; donanımsal hızlandırma; gerçek zamanlı veri toplama; havacılık; PX4 simülasyon ortamı; zaman etiketi karmaşıklığı.,Digital Twin; hardware acceleration; real-time data
136,2021-2022,Gerçek Zamanlı Veri Toplama Altyapısı,Real-Time Data Acquisition Infrastructure,"Demir Kuş test sisteminin bir parçası olarak, uçuş sırasında çeşitli sensör ve sistem bileşenlerinden gönderilen verilerin analiz edilebilmesi için gerçek zamanlı, güvenilir bir veri toplama altyapısına ihtiyaç vardır. Sistemin oluşturduğu veri boyutu uçuş sonunda tera-byte/giga-byte seviyesinde bir boyuta ulaşabildiğinden, altyapı uçuş sırasında verileri akış olarak olarak bu verileri gerçek zamanlı toplama ve işleme özelliklerine sahip olmalıdır. Projemizin amacı bu kriterleri başarılı bir şekilde sağlayan bir sistemin tasarlanması ve test edilmesidir.","As part of the Iron bird test system, a real-time, reliable data collection infrastructure is needed to analyze the data sent from various sensors and system components during flight. Since the data size generated by the system can reach a tera- byte/giga-byte level at the end of the flight, the infrastructure should have the ability to collect and process this data in real time as data flow during the flight. The aim of our project is to design and test a system that successfully meets these criteria. Keyworrds — Iron Bird, Sensors, Realtime, Data Acquisition","Iron Bird, Sensörler, Gerçek Zamanlı, Veri Toplama",
142,2021-2022,Gerçek Zamanlı Veri Toplama Alt Yapısı,Real - Time Data Acquisition Infrastructure,"Test altyapılarında ve dijital ikiz uygulamalarda veri toplamak ve farklı kaynaklardan toplanan bu verilerin eş zamanlı olarak zaman etiketlenmesi çok önemlidir. Projemizde veriler farklı frekanslarda olabileceğinden, zaman etiketleme ile verileri aynı zaman alanına taşıyacağız. Veri toplama cihazları çeşitli olabileceğinden çalışmamızda ortamın bağımsızlığı da dikkate alınarak standart PC, Raspberry Pi gibi farklı tip cihazlarda çalışabilen bir veri toplama yazılım altyapısı ile gerekli paket kitaplıkların oluşturulması planlanmıştır. ve veri toplama için Linux tabanlı bilgisayarlar. Bu sayede hem savunma alanında hem de diğer alanlarda gerçek zamanlı veri iletimi sorununu ve veri kaynağının ortamına bağlı olarak veri toplamada sorun yaratabilecek dış etkenleri en aza indirmiş olacağız. Aynı zamanda yazılım altyapısının farklı programlama dilleri ile entegre edilerek bir yazılım kütüphanesi oluşturulması planlanmaktadır.","It is very important to collect data in test infrastructures and digital twin applications and simultaneously time-tag these data collected from different sources. Since the data may be at different frequencies in our project, we will move the data to the same time domain by time tagging. Since data collection devices can be various, taking into account the independence of the environment in our study, it is planned to create the necessary package libraries with a data collection software infrastructure that can run on different types of devices such as standard PC, raspberry pi and Linux-based computers for data collection. In this way, we will minimize the problem of real-time data transmission both in the defense field and in other fields, and external factors that may cause problems in data collection depending on the environment of the data source. At the same time, it is planned to create a software library by integrating the software infrastructure with different programming languages.",Gerçek Zamanlı Veri; Veri Tabanı; Haberleşme Protokolleri.,Real Time Data; Database; Communication Protocols.
146,2021-2022,Gerçek Zamanlı Veri Toplama Alt Yapısı,Real-Time Data Collection Infrastructure,"Günümüzde 5G ve endüstri 4.0 vb. teknolojilerin gelişimi ile beraber farklı endüstriyel uygulamalarda veri üretimi hızla artmaktadır. Bununla birlikte bu verilerin toplanması ve işlenmesi de önemli hale gelmiştir. Bu konunun önemli olduğu alanlardan bir tanesi de dijital ikiz uygulamalarıdır. Bu çalışma ile verileri gerçek zamana yakın bulut tabanlı olarak toplayıp depolayabilen, aynı zamanda söz konusu verilerin görselleştirilebildiği bir veri toplama alt yapısı tasarımı ele alınmıştır.","Today, with the development of 5G and industry 4.0, data generation is more than ever. The amount of data produced per person increases logarithmically. However, the collection and processing of this data has become important in many industries. One of the areas where this issue is important is digital twin applications. With this study, a data collection infrastructure was designed that can collect and store data close to real time and at the same time visualize the collected data.","Dijital İkiz, Veri Yönetimi, Veri Görselleştirme, Gerçek Zamanlı Veri Toplama","Digital Twin, Data Management, Data Visualization, Real-Time Data Collection"
150,2021-2022,"Görsel Algılama ve Atalet Algılama Yöntemlerini Kullanabilen Bir Mikro Hava Aracının İnşası, Kontrol ve Otonom Yön Bulma Sistemi","Building, Control and Autonomous Navigation of a Micro Aerial Vehicle Using Visual and Inertial Sensing","Bu çalışmanın amacı, iyi tanımlanmış, kontrollü bir iç mekân ortamında platforma monteli bilgisayar kaynaklarını kullanarak, çevrimiçi durum kestirimi, kontrol ve otonom seyrüsefer yapabilen, bir Atalet Ölçüm Birimi (IMU), aşağı bakan bir kamera ve tek ışınlı bir yükseklik sensöründen oluşan bir sensör paketi ve hesaplama cihazlarıyla donatılmış küçük bir dikey iniş-kalkış platformunun üretimi ve yazılımının geliştirilmesidir. Bilgisayar destekli modelleme, üretim, algoritma geliştirme, sistem entegrasyonu ve deney aşamalarından meydana gelen bu proje, kontrol, seyrüsefer ve durum kestirim algoritmalarını uygulamak için gerekli teorik materyallerin öğrenilmesini de kapsamaktadır. Platform gövdesi, iniş takımları ve sensör montaj parçaları gibi mekanik parçalar satın alınmış veya 3B yazıcılar kullanılarak üretilmiştir. Ancak motorlar, elektronik hız kontrolörleri, otopilot sistemleri ve bilgisayarlar gibi elektronik parçalar satın alınmıştır. Bu parçaların en iyi kombinasyonunun seçimi ise, platformun toplam uçuş süresi, agresiflik seviyesi, azami yük kapasitesi gibi parametreler göz önünde bulundurularak proje ekibi tarafından yapılmıştır. Durum kestirim algoritması, AprilTag adı verilen bir dizi kare etiketin laboratuvar zeminine sabitlenmesi, algılanması ve eş zamanlı olarak konumlandırılması ve haritalanması prensibi (Simultaneous Localization and Mapping, SLAM) ile çalışmaktadır. SLAM ve otonom seyrüsefer uygulamalarının gerçek zamanlı koşması gereksinimi nedeniyle, tüm hesaplamaların platformda çalıştırılması ve C++ programlama dili kullanılmıştır. Bu proje, kapalı bir laboratuvar ortamında, GPS sinyalleri olmaksızın çalışabilmesi ile benzerlerinden ayrılmaktadır. Ayrıca, Havacılık Robotiği ile ilgili çalışmalar için deneysel bir düzenek sağlamaktadır.","The purpose of this study is the production and software development of a small vertical take-off and landing platform which is equipped with a sensor package consisting of Inertial Measurement Unit (IMU), a downward facing camera and a single-beam height sensor and calculation devices and can perform online state estimation, control and autonomous navigation in a well-defined, controlled interior environment by using platform-mounted computer resources. This project which consists of computer-aided modeling, manufacturing, algorithm development, system integration and experimental phases, includes learning the theoretical materials necessary to implement control, navigation and state estimation algorithms. Mechanical parts such as platform body, landing gear and sensor mounting parts were purchased or manufactured using 3D printers. However, electronics such as motors, electronic speed controllers, autopilot systems and computers were purchased. The choice of the best combination of these parts were made by the project team, taking into account the total flight time, aggressiveness level, maximum load capacity of the platform. The state estimation algorithm works with the principle of fixing to the laboratory floor, detecting and simultaneously positioning and mapping (Simultaneous Localization and Mapping, SLAM) of a series of square labels called AprilTag. Due to the need for SLAM and autonomous navigation algorithms to run in real time, all calculations must be run on the platform and the C++ programming language were used. This project is separated from its counterparts with its ability to operate without GPS signals in a closed laboratory environment. In addition, it also provides an experimental mechanism for studies on Aerial Robotics.","Durum Kestirimi, Kontrol, Otonom Seyrüsefer, Bilgisayar Görmesi","State Estimation, Control, Autonomous Navigation,"
156,2021-2022,"Güç Hatları için Pasif Bileşenlerle EMI Filtre Tasarımı, Üretimi ve Performans Testinin Gerçekleştirilmesi","EMI Filter Design, Manufacturing and Performance Testing with Passive Components for Power Lines","EMI (Elektromanyetik Girişim), elektrikli ve elektronik cihazların performansında azalmaya, bozulmaya veya arızaya neden olan her türlü sinyal olarak tanımlanabilir. Bu bozulma radyasyon veya iletim yoluyla yayılabilir. İletilen gürültüyü bastırmak için güç hattına takılan EMI filtrelerin kullanımı her geçen gün artmaktadır. Bu nedenle, bu çalışmada, güç kaynağı sebebiyle ortaya çıkan ortak ve diferansiyel mod gürültüleri bastırmak için pasif DC EMI filtre incelenmiştir. Tasarlanacak olan bu filtre, maksimum güç tüketimi 50 Watt olan ve 28V DC ile beslenen ekipmanın güç hattına yerleştirileceğinden askeri havacılık sektöründe kullanılması öngörülmektedir. Bu nedenle filtrenin monte edildiği ekipmanın MIL-STD- 461G standardında belirtilen CE102 testinden geçmesi gerekir. Bu çalışma sonucunda, pasif devre elemanları kullanılarak oluşturulan ve ekipman güç hattına takılan DC EMI filtre sayesinde istenilen gürültü bastırma performansı elde edilmiştir.","EMI (Electromagnetic Interference) can be defined as any kind of disturbance or sign that causes reductions in the performance, deterioration or malfunction of electrical and electronic devices. This disturbance can be propagated by radiation or conduction. The use of EMI filters installed in the power line to suppress conducted noise is increasing day by day. Therefore, in this paper, passive DC EMI filter has been studied to suppress both common and differential mode noises originating from the power supply. Due to the fact that this filter to be designed will be placed in the power line of the equipment, which has a maximum power consumption of 50 Watts and supplied with 28V DC, it is foreseen to be used in the military aviation industry. For this reason, the equipment on which the filter is installed must pass the CE102 test specified in the MIL-STD_461G standard. As a result, the desired noise suppression performance was achieved with the help of the EMI filter installed in the power line of the equipment, which was created using passive circuit elements.","elektromanyetik girişim, EMI filtre, ortak- diferansiyel mod, gürültü, MIL-STD-461G, güç hattı","electromagnetic interference, EMI filter, common mode- differential mode, noise, MIL-STD-461G, power line"
164,2021-2022,Hareketli Winglet Tasarımı ve Aerodinamik Analizi,Morphing Winglet Design and Aerodynamic Analysis,Bu çalışmada Onera M6 kanadı üzerine farklı uçuş rejimlerinde aerodinamik verimliliği artırmak için değişken cant açılı winglet tasarımı yapılmıştır. Bu wingletlerin aerodinamik analizleri yapılmış ve hareket yeteneği için bir mekanizma tasarlanmıştır. Wingletler uçağın sonlu kanat yapısından dolayı oluşan kanat ucu girdaplarının olumsuz etkilerini önlemek amacıyla tasarlanmış ek yapısal bileşenlerdir. Çalışmada wingletin cant açısı parametresi bağımsız değişken olarak ele alınmış ve hesaplamalı akışkanlar dinamiği yöntemlerinden Spalart Allmaras türbülans modeli kullanılarak kanadın aerodinamik parametreleri hesaplanmıştır. Bu sayede her uçuş rejimi için wingletlere en uygun cant açısı verilerek tüm uçuşun aerodinamik performans verimliliği artırılabilecektir.,"In this study, a variable cant angle winglet design was made on the Onera M6 wing to increase aerodynamic efficiency in different flight regimes. Aerodynamic analyzes of these winglets were made and a mechanism was designed for their movement skills. Winglets are additional structural components designed to prevent the negative effects of wing tip vortices caused by the finite wing structure of the aircraft. At the scope of the study, the cant angle parameter of the winglet was considered as an independent variable and the aerodynamic parameters of the wing were calculated using the Spalart Allmaras turbulence model, which is one of the computational fluid dynamics methods. In this way, the aerodynamic performance efficiency of the entire flight will be increased by giving the optimum cant angle to the winglets for each flight regime.","Cant Açısı, Hesaplamalı Akışkanlar Dinamiği, Hareketli Winglet, Kanat Ucu Girdabı, Onera M6.","Cant Angle, Computational Fluid Dynamics, Morphing Winglet, Onera M6, Wing-Type Vortices."
170,2021-2022,Hava Aracı Aksesuar Dişli Kutusu Tasarımı,Aircraft Accessory Gearbox Design,"Bu projenin temel amacı bir Uçak Aksesuar Şanzıman tasarlamaktır. Uçaklarda aksesuar dişli kutuları; Hidrolik pompa, jeneratör gibi ekipmanların ihtiyaç duyduğu mekanik gücü motordan ilgili ekipmanlara istenilen hız aralıklarında iletirler. Diğer bir işlevi ise 'Hava Türbini Marş'tan veya eşdeğer ekipmandan alınan yükü motorun çalıştırılması için motora iletmektir. Bu işlevleri yerine getirmek için dişliler, miller, yataklar, kamalar ve bu elemanları bir arada tutmak için yuva yapıları gibi makine elemanları kullanılarak bir dişli kutusu tasarlamaya ihtiyaç vardır. Bu tasarım projesi kapsamında, gereksinimleri TUSAŞ tarafından belirlenen teorik bir Hava Aracı Aksesuar Dişli Kutusu tasarlanmıştır. Bu proje kapsamında dişli, mil, yatak, şaft dişi gibi makine elemanlarının ve bu elemanları bir arada tutacak yuva yapılarının kullanıldığı bir dişli kutusu tasarımına ihtiyaç vardır. Belirlenecek güç, hız, dayanım ve yağlama gereksinimleri doğrultusunda makine elemanlarının tasarımı ve seçimi, gövde tasarımı, yağlama ve soğutma sistemi tasarımı gibi alt başlıklar altında özenle çalışmalar yapılmıştır. Genel olarak havacılık uygulamalarında, sektörde elde edilen verilere göre güvenlik faktörü 1,5 ile 2,5 arasında kullanılmaktadır, bu nedenle tasarımımız boyunca projede yaklaşık olarak 2'lik bir güvenlik faktörü kullanılmıştır. Bu, hesaplamalarımıza ve Sonlu Elemanlar Analizi yapılmıştır. Ayrıca, gerektiğinde Matlab gibi programlar kullanılarak mekanizmayı anlamak ve tasarlamak için simülasyonlar yapılmıştır. Halihazırda piyasada bulunan ürünler, pratik örnekler elde etmek ve tasarımımızda olası kullanımları değerlendirmek için karşılaştırmalar yapılmıştır.","The main objective of this project is to design an Aircraft Accessory Transmission. Accessory gearboxes in aircraft; They transmit the mechanical power required by equipment such as hydraulic pumps and generators from the engine to the related equipment at desired speed ranges. Another function is to transmit the load from the 'Air Turbine Starter' or equivalent equipment to the engine for engine starting. To fulfill these functions, there is a need to design a gearbox using machine elements such as gears, shafts, bearings, splines and housing structures to hold these elements together. Within the scope of this design project, a theoretical Accessory Gear Box whose requirements were determined by TAI was designed. Within the scope of this project, there is a need for a gearbox design in which machine elements such as gears, shafts, bearings, spline and housing structures to hold these elements together are used. In line with the power, speed, strength and lubrication requirements to be determined, careful studies were carried out under sub-headings such as the design and selection of machine elements, body design, lubrication and cooling system design. Generally, in aviation applications, the safety factor is used between 1.5 and 2.5 according to the data obtained in the sector, therefore, a safety factor of approximately 2 was used throughout our design in the project. This is based on our calculations and Finite Element Analysis. In addition, simulations were made to understand and design the mechanism using programs such as Matlab when necessary. Comparisons were made with products currently on the market to obtain practical examples and to evaluate possible uses in our design.","Dişli Kutusu, Dişli, Mil, Şaft Dişi, Güvenlik Faktörü",component; formatting; style; styling; key words.
